{
  "result": {
    "experiment_name": "aspirin_solubility",
    "conclusion": "Predicted log-solubility of aspirin in water at 25 C is -1.30.",
    "exit_code": 0,
    "certainty": {
      "confidence_interval": [0.1, 0.3],
      "expected": 0.2,
      "mean_squared_error": 0.05
    }
  },
  "output": [
    { "name": "run_log", "path_to_file": "/runs/aspirin-001/out.log" },
    { "name": "result_csv", "path_to_file": "/runs/aspirin-001/solubility.csv" }
  ],
  "resource_usage": {
    "total_cost": 1.25,
    "tokens_used": 1800,
    "token_cost": 0.25,
    "cpu_hours": 0.5,
    "gpu_hours": 0.0,
    "slurm_cost": 1.0,
    "total_time": "00:30:00",
    "start_time": "13:00:00",
    "end_time": "13:30:00"
  },
  "metadata": {
    "timestamp": "13:30:00",
    "ID": "result-aspirin-001",
    "tools_used": [
      { "name": "solubility_predictor", "version": 1.2 }
    ]
  }
}
